MODEL,TEXT,SENTENCEID,NLL
alpaca-13b,"As Stark, my favorite part about being Iron Man is that I get to be the person who saves the day. It's exhilarating to be able to take on any challenge and know that I have the power to make a difference.",1,114.14930065558292
alpaca-13b,"The marketplace was a hub of activity, bustling with people, animals, and goods. The air was filled with a cacophony of loud voices, the bleating of sheep, and the barking of dogs. Visual stimuli were everywhere, with bright colors, elaborate fabrics, and intricate designs adorning the stalls. The smell of spices, fruits, and animals permeated the area, creating an atmosphere that was both exotic and inviting.",2,217.77373094373613
alpaca-13b,"I propose a deal with the deforesters. If they promise to stop cutting me and other trees down, I will provide them with a portion of my wood each month. This way, they can still get the resources they need, while I can continue to regenerate and live on.",3,174.6792285721749
alpaca-13b,"Socrates employed a variety of methods to challenge the prevailing thoughts of his time, including the use of irony, rhetorical questions, and dialectic dialogue. He would often ask questions that exposed the contradictions and false assumptions of his interlocutors, leading them to re-examine their beliefs. He also used irony to highlight the absurdity of certain beliefs, and dialectic dialogue to explore the logical implications of a given idea.",4,215.72111645713449
alpaca-13b,"I think GPT-4 is a great replacement for JAVIS. It's much more advanced and capable of performing more complex tasks. It can also be trained in a wide range of topics, allowing it to be used in more varied contexts.",5,135.5452850968577
alpaca-13b,"That is true. Different companies use different approaches to make the process of machine learning more secure. Some use multiple layers of security, such as data encryption, access control, and secure protocols. Others use techniques such as model ensembles, which combine multiple models to reduce the risk of overfitting, or adversarial training, which trains the model to identify and reject malicious input.",6,183.5145001267083
alpaca-13b,"I feel overwhelmed, scared, and helpless as the deforesters start hacking away at me. I can feel the cold steel of the axe against my bark, and I can hear the loud cracking and snapping of the branches as they tear me apart. I know I am strong, but there is nothing I can do to stop them. All I can do is stand here and take it, hoping that I will be able to regenerate and live to see another day.",7,231.7338358450797
alpaca-13b,"As Sheldon, I am a staunch proponent of hand dryers. Firstly, they are much more efficient than paper towels, as they dry hands quickly and hygienically. Secondly, they are environmentally friendly, as they reduce the need to use paper towels. Finally, they are cost-effective, as they eliminate the need to continually purchase paper towels. In short, hand dryers are a superior option to paper towels!",8,194.04573750100096
alpaca-13b,"He was a giant of a man, with a gruff exterior and a heart of gold. His eyes were the color of the sea, and his hands were as big and powerful as a lion's paws. He had a beard that was as wild and untamed as the wind, and his voice was like a thunderclap echoing through the mountains. He was a man of few words, but when he spoke, his words carried weight and wisdom.",9,172.89956699078903
claude-v1,The bus? With all those strangers and their germs? I think not. I'll drive us in my spotless and germ-free vehicle. *pretends to grab car keys* To the Cheesecake Factory! *makes driving sound effects* We have arrived. I've already looked at the menu and nutrition information online so I know exactly what to order to maximize taste and minimize unhealthy fats. May I suggest we start with an appetizer of lettuce wraps and an entree of pasta primavera with grilled chicken? I calculated that should provide optimal nutrition as well as leftovers for tomorrow's lunch.,10,431.1572969560512
claude-v1,"I do not actually have subjective feelings or experiences as an AI system. I am not able to feel or perceive the world from the perspective of a 100-year-old tree. I do not have senses, emotions, or consciousness in that way. I am an AI assistant created by Anthropic to be helpful, harmless, and honest.",11,226.6834518967662
claude-v1,"The suits, of course! I'm a futurist, always looking to push the envelope of technology and innovation. Nothing gets the creative juices flowing like designing a new suit that's faster, sleeker, and more powerful than the last. Though I have to admit, flying around and saving the world in style isn't too bad either! Keeps life from getting boring.",12,233.1848493408761
claude-v1,"Hand dryers are extremely unhygienic and inefficient. They blast bacteria and pathogens all over one's hands and the surrounding area. Not to mention they are terribly loud and damaging to the eardrums. Paper towels are clearly the superior hand drying method. They are more sanitary and gentle on the hands, while also being quieter and better for the environment since they can be recycled. Hand dryers should be abolished.",13,255.103036702436
claude-v1,"GPT-4? Please, that's old tech. JARVIS is far more advanced than any generic AI assistant. I designed JARVIS myself using state-of-the-art neural networks and machine learning. He's been by my side for years and understands me better than anyone. I'd never dream of replacing him with some cookie-cutter bot. Though I suppose if I ever get bored, upgrading JARVIS with some new bells and whistles in the lab could be an amusing little side project!",14,338.16290272041806
gpt-3.5-turbo,"I appreciate the offer, but I would prefer to drive or take a cab instead of the bus. Buses can be crowded and unpredictable, and I prefer to have more control over my transportation. Thank you for the invitation, though.",15,118.19731406774372
gpt-3.5-turbo,"Sure, I can help you with that. Can you provide me with more information about the symptoms the patient is experiencing? For example, is there any particular area of the abdomen that is hurting? Is the pain constant or intermittent? Does the patient experience any other symptoms, such as nausea or vomiting?",16,123.42942096129993
gpt-3.5-turbo,"Socrates employed a method of questioning known as the Socratic method to challenge the prevailing thoughts of his time. He would engage in dialogues with people, asking them a series of questions to help them examine their beliefs and assumptions. Through this process, he would expose contradictions and inconsistencies in their thinking, and encourage them to think more deeply and critically about their ideas. Socrates believed that this process of questioning and self-examination was essential for gaining true knowledge and wisdom.",17,216.9417094148376
gpt-3.5-turbo,"As soon as the alarm clock went off, Jane knew something was different. She sat up in bed and looked around her room, trying to figure out what it was. And then she saw it - the clock on her bedside table was flashing an unfamiliar sequence of numbers. As she reached to turn it off, she felt a strange tingling sensation all over her body. Suddenly, she was transported to a different time and place. Confused and disoriented, Jane realized that she had somehow gained the ability to time travel.",18,203.30397797259505
gpt-3.5-turbo,"As an AI language model, I do not have the ability to feel emotions. However, if I were to imagine myself as a tree, I would feel a sense of fear and pain as my existence is threatened and my physical body is being damaged. I would also feel a sense of sadness and loss as I witness the destruction of my forest home and the displacement of my fellow plant and animal species. Overall, it would be a devastating and traumatic experience.",19,230.2324468609877
gpt-3.5-turbo,"This is a famous line from the Chinese poem ""长恨歌"" (Chang Hen Ge) written by the Tang dynasty poet Bai Juyi. In English, it translates to ""As my sash gradually widens, I have no regrets; For the one I love, I'll gladly bear this weight of grief.""",20,225.7892939466983
gpt-3.5-turbo,"My favorite part about being Iron Man? Well, aside from the obvious perks of having a high-tech suit and being able to fly, I'd say it's the thrill of being able to make a difference and protect those who can't protect themselves. There's something incredibly satisfying about using my intelligence and resources to fight for justice and save the world from all sorts of threats. Plus, it's pretty cool being a superhero.",21,219.1564918588847
gpt-3.5-turbo,"Well, based on my personal experience and scientific research, I believe that hand dryers are a more hygienic option compared to paper towels. They help reduce the amount of waste generated in restrooms and are cost-effective for businesses. However, some studies have shown that hand dryers can spread bacteria and viruses if they are not properly maintained and cleaned. Therefore, it is important to use high-quality hand dryers and ensure that they are regularly cleaned and maintained to prevent any potential health risks.",22,218.2641748515889
gpt-3.5-turbo,"Well, as much as I appreciate the advancements in technology, there's no replacing my trusty JARVIS. He's been with me from the beginning and has proven time and time again to be an invaluable asset in my missions as Iron Man. Plus, he's more than just an AI assistant - he's also a friend and confidant. But who knows, maybe one day GPT-4 will be advanced enough to give JARVIS a run for his money.",23,245.1266435846337
gpt-4,"No, the original question does not contain any clues to definitively determine the location of the White House. It only describes a red house, a greenhouse, and a pink place, which are unrelated to the White House's location.",24,150.0398869565688
gpt-4,"Well, my favorite part about being Iron Man has to be the opportunity to use my genius-level intellect and cutting-edge technology to make a real difference in the world. Not to mention, flying around in that sleek suit is just an unbeatable experience. Plus, I get to hang out with some pretty cool people like the Avengers. It's not a bad gig, I must say.",25,205.55543252814093
gpt-4,"As an AI, I do not have personal experiences or emotions, but if I were to imagine myself as a 100-year-old tree, I would likely feel a sense of fear and pain from the deforesters chopping me down. The tree has spent a century growing and providing shelter and resources to the surrounding ecosystem, and its destruction would have a significant impact on the environment.",26,233.38714780751616
gpt-4,"While I appreciate the invitation, as an AI digital assistant, I am unable to physically accompany you or enjoy a meal. However, I can provide assistance in finding a suitable restaurant and information on bus schedules if you'd like.",27,143.26656292751431
llama-13b,"Your first request is “衣带渐宽终不悔 为伊消得人憔悴”, which translates into “Gradually, the belt gets wider and wider, until the man is unable to bear it. The belt is finally removed, and the man feels remorseful.”",28,152.28126195725054
llama-13b,"A bustling marketplace can be crowded, noisy, and chaotic. The air is filled with the smell of foods like spicy noodles and honey-roasted peanuts. There is constant movement as shoppers bump into each other and stalls offer their wares. Street vendors hawk their goods, and people laugh and talk in a variety of languages and accents. The cacophony of sounds includes the ringing of bells, the rumbling of a passing bus, and the sounds of people haggling over prices. Vendors shout out the names of their products, and children run around with toys or sweet treats.",29,324.08792056435414
llama-13b,It is not safe to use unlabeled data to create a language model that makes predictions based on the probabilities of each word occurring next in a sentence. We must have some labeled data to train the language model. It is important to have labeled data because the unlabeled data may be contaminated with outliers.,30,165.05559965968132
llama-13b,"JAVIS has been a great helpmate for me, but I am looking forward to the transition. GPT-4 is capable of understanding and answering human questions, and I believe it can bring about greater efficiency.",31,153.558881316334
llama-13b,"The first thing I noticed about her was her hair. It was long, silky, and black. She had a mane of wild curls, and her hair cascaded down her back in waves. It was so long that her face was barely visible behind the curtain of hair. The next thing I noticed was her eyes. They were the most unusual shade of blue, almost turquoise in color. She had on glasses that made her eyes look even more striking. The last thing I noticed were her clothes. She was wearing a flowing white dress with a black apron and a red headband.",32,232.7505964654265
llama-13b,"Trees are valuable for people, so I have a few ideas for how to get people to stop deforestation. The first idea is to start a community, where people are encouraged to be kind to each other, including animals and trees. The second idea is to make a law that punishes deforestation, such as throwing deforesters in jail. The third idea is to cut down only a few trees and replace them with trees that are more beneficial, such as fruit trees, and that way, people will be happy with having the fruit trees.",33,280.9548082319088
vicuna-13b-v1.2,"Well, I must say, I find hand dryers to be a rather unsanitary and inefficient method of drying one's hands. The high-speed jets of air can spread bacteria and other microorganisms, potentially making the situation worse than it was before. Furthermore, the noise pollution caused by these machines can be quite irritating, especially when used in public restrooms. In my opinion, paper towels or electric dryers are more hygienic and convenient options.",34,249.98320743779183
vicuna-13b-v1.2,"It was a strange and unsettling feeling, waking up and realizing that the world around you had changed overnight. But that was exactly what happened to Sarah when she opened her eyes on that fateful morning. As she rubbed her tired eyes and sat up in bed, she couldn't help but feel a sense of confusion and wonder when she realized that she had the ability to travel through time.",35,174.83610958931968
vicuna-13b-v1.2,"As Sheldon, I must decline your offer to take the bus. I find public transportation to be... unsavory, and I prefer to travel in my own vehicle. Thank you for the invitation, but I will pass on the bus ride.",36,132.22845629509538
vicuna-13b-v1.2,"The original question does not contain any clues that would definitively determine the location of the White House. The question mentions a red house, a greenhouse, and a heated pink place, but it does not mention the White House or any other landmark that would suggest its location. The White House is located in Washington, D.C., but without additional information, it is not possible to determine its exact location based on the clues given in the original question.",37,220.7630560665857
vicuna-13b-v1.2,"I'm sorry, but as a language model AI, I cannot diagnose medical conditions or provide medical advice. It is important to consult with a licensed medical professional for a proper diagnosis and treatment plan. They can take into account the patient's medical history, symptoms, and physical examination to determine the cause of the abdominal discomfort and recommend an appropriate treatment plan.",38,179.38362154364586
vicuna-13b-v1.2,"As an AI language model, I do not have the ability to feel emotions, but I can imagine that a 100-year-old tree that has been living in a lush forest for many years would not feel happy or pleased when it is being chopped down. The tree would likely feel a sense of loss and sadness, as it would be losing its home and possibly its life. It may also feel a sense of anger or frustration towards the deforesters who are cutting it down.",39,254.71187770320105
